{
  "schema": "exocore.language.v1",
  "expression_id": "exocore.persistence.status.v1",
  "term": "query",
  "kind": "query",
  "module_id": "persistence",
  "version": "1.0.0",
  "authority_class": "evidence",
  "effect": "local-read",
  "input_contract": "exocore.persistence.status-request.v1",
  "output_contract": "exocore.persistence.status.v1",
  "diagnostic_namespace": "exocore.persistence.diagnostic.v1",
  "extensions": {}
}
